{
  "$schema": "https://json-schema.org/draft/2020-12/schema",
  "$id": "https://example.invalid/everything-exam-preparation/atomic_knowledge_ledger.schema.json",
  "title": "AtomicKnowledgeLedger",
  "type": "object",
  "required": ["ledger_id", "target_group_key", "units", "coverage_floor", "qa_status"],
  "properties": {
    "object_type": { "const": "AtomicKnowledgeLedger" },
    "ledger_id": { "type": "string", "minLength": 1 },
    "target_group_key": { "type": "string", "minLength": 1 },
    "units": {
      "type": "array",
      "items": {
        "type": "object",
        "required": [
          "unit_id",
          "source_id",
          "lecture_id",
          "slide_or_page_range",
          "raw_heading",
          "raw_text_summary",
          "unit_type",
          "student_visibility",
          "bound_module_id",
          "coverage_status"
        ],
        "properties": {
          "unit_id": { "type": "string", "minLength": 1 },
          "source_id": { "type": "string", "minLength": 1 },
          "lecture_id": { "type": "string" },
          "slide_or_page_range": { "type": "string" },
          "raw_heading": { "type": "string" },
          "raw_text_summary": { "type": "string" },
          "unit_type": {
            "enum": [
              "definition",
              "term",
              "contrast_pair",
              "criteria_item",
              "mechanism_step",
              "method_step",
              "equation",
              "calculation_rule",
              "graph_readout",
              "diagram_label",
              "table_entry",
              "named_example",
              "disease_case",
              "drug_case",
              "limitation",
              "misconception",
              "administrative",
              "decorative",
              "duplicate",
              "unreadable_visual"
            ]
          },
          "student_visibility": {
            "enum": [
              "include_in_notes",
              "internal_audit_only",
              "exclude_admin",
              "duplicate_covered_elsewhere",
              "requires_visual_inspection"
            ]
          },
          "bound_module_id": { "type": ["string", "null"] },
          "coverage_status": {
            "enum": [
              "covered",
              "grouped_but_named",
              "audit_only",
              "excluded_with_reason",
              "missing"
            ]
          }
        },
        "additionalProperties": false
      }
    },
    "coverage_floor": {
      "type": "object",
      "required": ["protected_units_total", "visible_units_bound", "missing_units"],
      "properties": {
        "protected_units_total": { "type": "integer", "minimum": 0 },
        "visible_units_bound": { "type": "integer", "minimum": 0 },
        "missing_units": { "type": "array", "items": { "type": "string" } }
      },
      "additionalProperties": false
    },
    "qa_status": { "enum": ["pass", "warn", "block"] }
  },
  "additionalProperties": false
}
