{
  "object_type": "AtomicKnowledgeLedger",
  "ledger_id": "omics_density_ledger_001",
  "target_group_key": "generic_omics_fixture",
  "units": [
    {"unit_id": "aku_001", "source_id": "omics_fixture", "lecture_id": "L1", "slide_or_page_range": "1", "raw_heading": "Omics vocabulary", "raw_text_summary": "Core omics terms and data-scale logic.", "unit_type": "term", "student_visibility": "include_in_notes", "bound_module_id": "module_omics_vocabulary", "coverage_status": "covered"},
    {"unit_id": "aku_002", "source_id": "omics_fixture", "lecture_id": "L1", "slide_or_page_range": "2", "raw_heading": "PCR primer logic", "raw_text_summary": "Primer orientation, specificity, and amplification boundary.", "unit_type": "method_step", "student_visibility": "include_in_notes", "bound_module_id": "module_pcr_primer_logic", "coverage_status": "covered"},
    {"unit_id": "aku_003", "source_id": "omics_fixture", "lecture_id": "L1", "slide_or_page_range": "3", "raw_heading": "DNA ligase mechanism", "raw_text_summary": "Phosphodiester bond joining in cloning.", "unit_type": "mechanism_step", "student_visibility": "include_in_notes", "bound_module_id": "module_dna_ligase_mechanism", "coverage_status": "covered"},
    {"unit_id": "aku_004", "source_id": "omics_fixture", "lecture_id": "L1", "slide_or_page_range": "4", "raw_heading": "Restriction cloning", "raw_text_summary": "Restriction enzyme digestion and compatible ends.", "unit_type": "method_step", "student_visibility": "include_in_notes", "bound_module_id": "module_restriction_cloning", "coverage_status": "covered"},
    {"unit_id": "aku_005", "source_id": "omics_fixture", "lecture_id": "L1", "slide_or_page_range": "5", "raw_heading": "BioBrick Golden Gate Gibson cloning", "raw_text_summary": "Named assembly methods must remain separated.", "unit_type": "named_example", "student_visibility": "include_in_notes", "bound_module_id": "module_biobrick_golden_gate_gibson", "coverage_status": "covered"},
    {"unit_id": "aku_006", "source_id": "omics_fixture", "lecture_id": "L1", "slide_or_page_range": "6", "raw_heading": "Mutagenesis QuikChange DpnI", "raw_text_summary": "Primer-mediated mutagenesis and template removal.", "unit_type": "method_step", "student_visibility": "include_in_notes", "bound_module_id": "module_mutagenesis_quikchange_dpni", "coverage_status": "covered"},
    {"unit_id": "aku_007", "source_id": "omics_fixture", "lecture_id": "L2", "slide_or_page_range": "7", "raw_heading": "Sanger sequencing", "raw_text_summary": "Chain termination and read interpretation.", "unit_type": "method_step", "student_visibility": "include_in_notes", "bound_module_id": "module_sanger_sequencing", "coverage_status": "covered"},
    {"unit_id": "aku_008", "source_id": "omics_fixture", "lecture_id": "L2", "slide_or_page_range": "8", "raw_heading": "454 pyrosequencing", "raw_text_summary": "Pyrophosphate-linked light readout.", "unit_type": "method_step", "student_visibility": "include_in_notes", "bound_module_id": "module_454_pyrosequencing", "coverage_status": "covered"},
    {"unit_id": "aku_009", "source_id": "omics_fixture", "lecture_id": "L2", "slide_or_page_range": "9", "raw_heading": "Illumina platform choice", "raw_text_summary": "Sequencing-by-synthesis and platform-choice logic.", "unit_type": "method_step", "student_visibility": "include_in_notes", "bound_module_id": "module_illumina_platform_choice", "coverage_status": "covered"},
    {"unit_id": "aku_010", "source_id": "omics_fixture", "lecture_id": "L2", "slide_or_page_range": "10", "raw_heading": "Coverage and assembly", "raw_text_summary": "Read depth and contig assembly.", "unit_type": "graph_readout", "student_visibility": "include_in_notes", "bound_module_id": "module_coverage_and_assembly", "coverage_status": "covered"},
    {"unit_id": "aku_011", "source_id": "omics_fixture", "lecture_id": "L2", "slide_or_page_range": "11", "raw_heading": "BLAST homology orthology paralogy", "raw_text_summary": "Sequence similarity and evolutionary relationship terms.", "unit_type": "definition", "student_visibility": "include_in_notes", "bound_module_id": "module_blast_homology_orthology_paralogy", "coverage_status": "covered"},
    {"unit_id": "aku_012", "source_id": "omics_fixture", "lecture_id": "L2", "slide_or_page_range": "12", "raw_heading": "Genome annotation pipeline", "raw_text_summary": "Predict, assign, and validate features.", "unit_type": "method_step", "student_visibility": "include_in_notes", "bound_module_id": "module_genome_annotation_pipeline", "coverage_status": "covered"},
    {"unit_id": "aku_013", "source_id": "omics_fixture", "lecture_id": "L3", "slide_or_page_range": "13", "raw_heading": "Transcriptomics RNA-seq", "raw_text_summary": "RNA abundance and differential expression.", "unit_type": "method_step", "student_visibility": "include_in_notes", "bound_module_id": "module_transcriptomics_rna_seq", "coverage_status": "covered"},
    {"unit_id": "aku_014", "source_id": "omics_fixture", "lecture_id": "L3", "slide_or_page_range": "14", "raw_heading": "Protein informatics", "raw_text_summary": "Protein features and database interpretation.", "unit_type": "method_step", "student_visibility": "include_in_notes", "bound_module_id": "module_protein_informatics", "coverage_status": "covered"},
    {"unit_id": "aku_015", "source_id": "omics_fixture", "lecture_id": "L3", "slide_or_page_range": "15", "raw_heading": "Expression systems", "raw_text_summary": "Host choice and expression constraints.", "unit_type": "criteria_item", "student_visibility": "include_in_notes", "bound_module_id": "module_expression_systems", "coverage_status": "covered"},
    {"unit_id": "aku_016", "source_id": "omics_fixture", "lecture_id": "L3", "slide_or_page_range": "16", "raw_heading": "His-tag purification", "raw_text_summary": "Affinity tag capture and elution.", "unit_type": "method_step", "student_visibility": "include_in_notes", "bound_module_id": "module_his_tag_purification", "coverage_status": "covered"},
    {"unit_id": "aku_017", "source_id": "omics_fixture", "lecture_id": "L3", "slide_or_page_range": "17", "raw_heading": "Proteomics workflow", "raw_text_summary": "Protein separation, mass spectrometry, and identification.", "unit_type": "method_step", "student_visibility": "include_in_notes", "bound_module_id": "module_proteomics_workflow", "coverage_status": "covered"},
    {"unit_id": "aku_018", "source_id": "omics_fixture", "lecture_id": "L3", "slide_or_page_range": "18", "raw_heading": "Metabolomics", "raw_text_summary": "Metabolite profiling and interpretation.", "unit_type": "term", "student_visibility": "include_in_notes", "bound_module_id": "module_metabolomics", "coverage_status": "covered"},
    {"unit_id": "aku_019", "source_id": "omics_fixture", "lecture_id": "L3", "slide_or_page_range": "19", "raw_heading": "Genetic manipulation CRISPR homologous recombination", "raw_text_summary": "Genome editing and recombination workflows.", "unit_type": "method_step", "student_visibility": "include_in_notes", "bound_module_id": "module_genetic_manipulation_crispr_homologous_recombination", "coverage_status": "covered"}
  ],
  "coverage_floor": {
    "protected_units_total": 19,
    "visible_units_bound": 19,
    "missing_units": []
  },
  "qa_status": "pass"
}
